{
  "$schema": "../src/schema.json",
  "name": "JavaTPoint",
  "url": "https://www.javatpoint.com/",
  "type": "tutorial",
  "description": "プログラミングやフレームワークについての学習ができるチュートリアルサイト。Java、Python、C++など多くの言語をカバーしている。",
  "topics": ["Java", "Python", "C++", "JavaScript", "SQL", "PHP", "Spring", "Hibernate"],
  "style": "reading",
  "pricing": "free",
  "introducer": {
    "github": "@chi1180"
  }
}
